{
  "$schema": "https://json-schema.org/draft/2020-12/schema",
  "$id": "stage_receipt.schema.json",
  "title": "Graphify Refactor Stage Receipt",
  "type": "object",
  "required": ["stage_id", "status", "summary", "commands", "artifacts", "metrics", "facts"],
  "properties": {
    "stage_id": {"type": "string"},
    "status": {"const": "passed"},
    "summary": {"type": "string", "minLength": 1},
    "commands": {
      "type": "array",
      "items": {
        "type": "object",
        "required": ["command", "exit_code"],
        "properties": {
          "command": {"type": "string"},
          "exit_code": {"type": "integer"},
          "log": {"type": "string"}
        },
        "additionalProperties": true
      }
    },
    "artifacts": {
      "type": "array",
      "items": {
        "oneOf": [
          {"type": "string"},
          {
            "type": "object",
            "required": ["path"],
            "properties": {
              "path": {"type": "string"},
              "base": {"enum": ["repo", "pack", "absolute"]},
              "description": {"type": "string"}
            },
            "additionalProperties": true
          }
        ]
      }
    },
    "metrics": {"type": "object"},
    "facts": {"type": "object"},
    "notes": {"type": "array", "items": {"type": "string"}},
    "started_at": {"type": "string"},
    "completed_at": {"type": "string"}
  },
  "additionalProperties": true
}
