{
  "stage_id": "REPLACE_STAGE_ID",
  "status": "passed",
  "summary": "What was implemented and what observable result proves it.",
  "commands": [
    {
      "command": "pytest ...",
      "exit_code": 0,
      "log": "pack:artifacts/receipts/REPLACE_STAGE_ID.log"
    }
  ],
  "artifacts": [
    {
      "path": "path/relative/to/repository/root",
      "base": "repo",
      "description": "Primary stage evidence"
    }
  ],
  "metrics": {},
  "facts": {},
  "notes": []
}
